<?xml version='1.0' encoding='UTF-8'?>

<!ELEMENT xep ( header, section1* ) >
<!ELEMENT header ( title, abstract, legal, number, status, type, sig, approver, dependencies, supersedes, supersededby, shortname, schemaloc*, registry?, expires?, author+, revision+ ) >
<!ELEMENT title (#PCDATA)* >
<!ELEMENT abstract (#PCDATA)* >
<!ELEMENT legal ( conformance, copyright, permissions, warranty ) >
<!ELEMENT conformance (#PCDATA | link)* >
<!ELEMENT copyright (#PCDATA | link)* >
<!ELEMENT permissions (#PCDATA | link)* >
<!ELEMENT warranty (#PCDATA | link)* >
<!ELEMENT number (#PCDATA)* >
<!ELEMENT status (#PCDATA)* >
<!ELEMENT type (#PCDATA)* >
<!ELEMENT sig (#PCDATA)* >
<!ELEMENT approver (#PCDATA)* >
<!ELEMENT dependencies ( spec* ) >
<!ELEMENT supersedes ( spec? ) >
<!ELEMENT supersededby ( spec? ) >
<!ELEMENT spec (#PCDATA)* >
<!ELEMENT shortname (#PCDATA)* >
<!ELEMENT schemaloc ( ns?, url ) >
<!ELEMENT ns (#PCDATA)* >
<!ELEMENT url (#PCDATA)* >
<!ELEMENT registry EMPTY>
<!ELEMENT expires (#PCDATA)* >
<!ELEMENT author ( firstname, surname, authornote?, org?, email?, jid?, uri? ) >
<!ELEMENT firstname (#PCDATA)* >
<!ELEMENT surname (#PCDATA)* >
<!ELEMENT authornote EMPTY>
<!ELEMENT org (#PCDATA)* >
<!ELEMENT email (#PCDATA)* >
<!ELEMENT jid (#PCDATA)* >
<!ELEMENT uri (#PCDATA)* >
<!ELEMENT revision ( version, date, initials, remark ) >
<!ELEMENT version (#PCDATA)* >
<!ELEMENT date (#PCDATA)* >
<!ELEMENT initials (#PCDATA)* >
<!ELEMENT remark ( p | ul )* >
<!ELEMENT section1 ( div | p | section2 | example | code | ul | ol | table )* >
<!ATTLIST section1
          topic CDATA '' 
          anchor CDATA '' >
<!ELEMENT section2 ( div | p | section3 | example | code | ul | ol | table )* >
<!ATTLIST section2
          topic CDATA '' 
          anchor CDATA '' >
<!ELEMENT section3 ( div | p | section4 | example | code | ul | ol | table )* >
<!ATTLIST section3
          topic CDATA '' 
          anchor CDATA '' >
<!ELEMENT section4 ( div | p | example | code | ul | ol | table )* >
<!ATTLIST section4
          topic CDATA '' 
          anchor CDATA '' >
<!ELEMENT div ( div | p | example | code | ul | ol | table )* >
<!ATTLIST div 
          class CDATA ''
          style CDATA '' >
<!ELEMENT p (#PCDATA | img | link | note | tt | dfn | em | strong | cite | span)* >
<!ATTLIST p 
          class CDATA ''
          style CDATA '' >
<!ELEMENT ul (li+) >
<!ATTLIST ul 
          class CDATA '' 
          style CDATA '' >
<!ELEMENT ol (li+) >
<!ATTLIST ol 
          class CDATA '' 
          start CDATA '' 
          style CDATA '' >
<!ELEMENT li (#PCDATA | p | link | note | tt | em | strong | span)* >
<!ATTLIST li 
          class CDATA '' 
          style CDATA '' >
<!ELEMENT img EMPTY>
<!ATTLIST img src CDATA '' >
<!ELEMENT link (#PCDATA)* >
<!ATTLIST link url CDATA '' >
<!ELEMENT note (#PCDATA | link | tt | dfn | em | strong | cite | span)* >
<!ELEMENT example (#PCDATA)* >
<!ATTLIST example caption CDATA '' >
<!ELEMENT code (#PCDATA)* >
<!ATTLIST code caption CDATA '' >
<!ELEMENT table (tr)* >
<!ATTLIST table caption CDATA '' >
<!ELEMENT tr ( th | td )* >
<!ELEMENT th (#PCDATA)* >
<!ATTLIST th 
          colspan CDATA ''
          rowspan CDATA '' >
<!ELEMENT td (#PCDATA)* >
<!ATTLIST td 
          colspan CDATA ''
          rowspan CDATA '' >
<!ELEMENT tt (#PCDATA)* >
<!ELEMENT dfn (#PCDATA)* >
<!ELEMENT em (#PCDATA)* >
<!ELEMENT strong (#PCDATA)* >
<!ELEMENT cite (#PCDATA)* >
<!ELEMENT span (#PCDATA)* >
<!ATTLIST span 
          class CDATA ''
          style CDATA '' >
