<?xml version='1.0' encoding='UTF-8'?>
<!DOCTYPE xep SYSTEM 'xep.dtd' [
  <!ENTITY % ents SYSTEM 'xep.ent'>
%ents;
]>
<?xml-stylesheet type='text/xsl' href='xep.xsl'?>
<xep>
<header>
  <title>XMPP Basic Client 2008</title>
  <abstract>This document defines the XMPP Basic Client 2008 compliance level.</abstract>
  &LEGALNOTICE;
  <number>0211</number>
  <status>Proposed</status>
  <type>Standards Track</type>
  <sig>Standards</sig>
  <dependencies>
    <spec>XMPP Core</spec>
    <spec>XMPP IM</spec>
    <spec>XEP-0030</spec>
    <spec>XEP-0106</spec>
    <spec>XEP-0115</spec>
    <spec>XEP-0138</spec>
  </dependencies>
  <supersedes/>
  <supersededby/>
  <shortname>N/A</shortname>
  &stpeter;
  <revision>
    <version>0.3</version>
    <date>2007-06-11</date>
    <initials>psa</initials>
    <remark><p>Changed XMPP Core and XMPP IM references to bis drafts; added implementation notes.</p></remark>
  </revision>
  <revision>
    <version>0.2</version>
    <date>2007-05-11</date>
    <initials>psa</initials>
    <remark><p>Added JID Escaping (XEP-0106) and Stream Compression (XEP-0138) as recommended.</p></remark>
  </revision>
  <revision>
    <version>0.1</version>
    <date>2007-04-20</date>
    <initials>psa</initials>
    <remark><p>Initial published version.</p></remark>
  </revision>
  <revision>
    <version>0.0.1</version>
    <date>2007-03-30</date>
    <initials>psa</initials>
    <remark><p>First draft, split from XEP-0073.</p></remark>
  </revision>
</header>
<section1 topic='Introduction' anchor='intro'>
  <p>The &XSF; defines protocol suites for the purpose of compliance testing and software certification. This document specifies the XMPP Basic Client 2008 certification level.</p>
</section1>
<section1 topic='Definition' anchor='def'>
  <p>The XMPP Basic Client 2008 certification level is defined as follows:</p>
  <table caption='Required and Recommended Specifications'>
    <tr>
      <th>Specification</th>
      <th>Requirement Level</th>
    </tr>
    <tr>
      <td><strong>&rfc3920bis;</strong></td>
      <td>REQUIRED *</td>
    </tr>
    <tr>
      <td><strong>&rfc3921bis;</strong></td>
      <td>REQUIRED *</td>
    </tr>
    <tr>
      <td><strong>&xep0030;</strong></td>
      <td>REQUIRED</td>
    </tr>
    <tr>
      <td><strong>&xep0106;</strong></td>
      <td>RECOMMENDED</td>
    </tr>
    <tr>
      <td><strong>&xep0115;</strong></td>
      <td>REQUIRED</td>
    </tr>
    <tr>
      <td><strong>&xep0138;</strong></td>
      <td>RECOMMENDED</td>
    </tr>
  </table>
  <p>* Note: &xmppcore; and &xmppim; are currently being revised to incorporate errata and feedback based on implementation experience; because it is expected that the revision process will be complete well before this compliance level takes effect, developers are advised to implement the specifications as defined in draft-saintandre-rfc3920bis and draft-saintandre-rfc3921bis rather than RFC 3920 and RFC 3921.</p>
</section1>
<section1 topic='Implementation Notes' anchor='impl'>
  <p>Some of the protocol specifications referenced herein have their own dependencies; developers must refer to the relevant specifications for further information.</p>
</section1>
<section1 topic='Security Considerations' anchor='security'>
  <p>This document introduces no additional security considerations above and beyond those defined in the documents on which it depends.</p>
</section1>
<section1 topic='IANA Considerations' anchor='iana'>
  <p>This document requires no interaction with &IANA;.</p> 
</section1>
<section1 topic='XMPP Registrar Considerations' anchor='registrar'>
  <p>This document requires no interaction with the &REGISTRAR;.</p> 
</section1>
</xep>
