<?xml version='1.0' encoding='UTF-8'?>
<!DOCTYPE xep SYSTEM 'xep.dtd' [
  <!ENTITY % ents SYSTEM 'xep.ent'>
%ents;
]>
<?xml-stylesheet type='text/xsl' href='xep.xsl'?>
<xep>
<header>
  <title>XMPP Intermediate Client 2008</title>
  <abstract>This document defines the XMPP Intermediate Client 2008 compliance level.</abstract>
  &LEGALNOTICE;
  <number>0213</number>
  <status>Experimental</status>
  <type>Standards Track</type>
  <sig>Standards</sig>
  <dependencies>
    <spec>XMPP Core</spec>
    <spec>XMPP IM</spec>
    <spec>XEP-0045</spec>
    <spec>XEP-0071</spec>
    <spec>XEP-0085</spec>
  </dependencies>
  <supersedes/>
  <supersededby/>
  <shortname>N/A</shortname>
  &stpeter;
  <revision>
    <version>0.1</version>
    <date>2007-04-20</date>
    <initials>psa</initials>
    <remark><p>Initial published version.</p></remark>
  </revision>
  <revision>
    <version>0.0.1</version>
    <date>2007-03-30</date>
    <initials>psa</initials>
    <remark>First draft, split from XEP-0117.</remark>
  </revision>
</header>
<section1 topic='Introduction' anchor='intro'>
  <p>The &XSF; defines protocol suites for the purpose of compliance testing and software certification. This document specifies the XMPP Intermediate Client 2008 certification level.</p>
</section1>
<section1 topic='Definition' anchor='def'>
  <p>The XMPP Intermediate Client 2008 certification level is defined as follows:</p>
  <table caption='Required and Recommended Specifications'>
    <tr>
      <th>Specification</th>
      <th>Requirement Level</th>
    </tr>
    <tr>
      <td><strong>XMPP Basic Client 2008</strong></td>
      <td>REQUIRED</td>
    </tr>
    <tr>
      <td>&xep0045;</td>
      <td>REQUIRED</td>
    </tr>
    <tr>
      <td>&xep0071;</td>
      <td>REQUIRED</td>
    </tr>
    <tr>
      <td>&xep0085;</td>
      <td>REQUIRED</td>
    </tr>
  </table>
  <p>Note: These protocols have their own dependencies, which include the following XEPs (as well as various IETF RFCs and W3C specifications):</p>
  <ul>
    <li>&xep0004;</li>
    <li>&xep0068;</li>
    <li>&xep0082;</li>
  </ul>
</section1>
<section1 topic='Security Considerations' anchor='security'>
  <p>This document introduces no additional security considerations above and beyond those defined in the documents on which it depends.</p>
</section1>
<section1 topic='IANA Considerations' anchor='iana'>
  <p>This document requires no interaction with &IANA;.</p> 
</section1>
<section1 topic='XMPP Registrar Considerations' anchor='registrar'>
  <p>This document requires no interaction with the &REGISTRAR;.</p> 
</section1>
</xep>
